User Input,Chatbot Response,Timestamp
hello,Hi there,2024-09-10 01:21:51
how are you ,My purpose is to assist you,2024-09-10 01:21:57
weather ,"I'm sorry, I cannot provide real-time weather information.",2024-09-10 01:22:20
How do I create a budget,"To make a budget, start by tracking your income and expenses. Then, allocate your income towards essential expenses like rent, food, and bills. Next, allocate some of your income towards savings and debt repayment. Finally, allocate the remainder of your income towards discretionary expenses like entertainment and hobbies.",2024-09-10 01:22:30
Today is a nice weather,"I'm sorry, I cannot provide real-time weather information.",2024-10-03 08:29:52
How's the weather today,"I'm sorry, I cannot provide real-time weather information.",2024-10-03 08:30:47
Hi,Hello,2024-10-03 08:30:56
Hi how are you?,Nothing much,2024-12-09 18:28:18
i have a customer query,Growing a vegetable garden allows you to enjoy fresh produce and connect with nature.,2024-12-09 18:28:35
hii how are you ,Nothing much,2024-12-09 18:29:31
i lost my best friend ,Growing a vegetable garden allows you to enjoy fresh produce and connect with nature.,2024-12-09 18:29:47
How do I create a budget,"To create a budget, start by setting financial goals for yourself. Then, track your income and expenses for a few months to get a sense of where your money is going. Next, create a budget by allocating your income towards essential expenses, savings and debt repayment, and discretionary expenses.",2024-12-09 18:30:38
How do I create a app,"To create a budget, start by setting financial goals for yourself. Then, track your income and expenses for a few months to get a sense of where your money is going. Next, create a budget by allocating your income towards essential expenses, savings and debt repayment, and discretionary expenses.",2024-12-09 18:30:47
hii,"Gardening tips include choosing the right plants for your climate, watering properly, and using organic fertilizers.",2024-12-09 18:30:55
how is weather,"Mindfulness is the practice of being fully present in the moment, observing thoughts and feelings without judgment.",2024-12-09 18:32:28
You're awesome,"Thank you! I'm just a program, but I'm here to assist and make your experience better.",2024-12-09 18:42:04
hi,Hi there,2024-12-09 18:45:44
i need help ,How can I assist you?,2024-12-09 18:46:03
how are you ?,Hello,2024-12-09 18:46:14
how are you,Hello,2024-12-09 18:46:21
I,"Gardening tips include choosing the right plants for your climate, watering properly, and using organic fertilizers.",2024-12-09 18:47:00
I want to create a news application,"Gardening tips include choosing the right plants for your climate, watering properly, and using organic fertilizers.",2024-12-09 18:47:17
hii,"Gardening tips include choosing the right plants for your climate, watering properly, and using organic fertilizers.",2024-12-09 19:20:12
hi,Hey,2024-12-09 19:20:16
what are you,I can answer questions and provide assistance,2024-12-09 23:49:06
can you help me,How can I assist you?,2024-12-09 23:52:06
What is a credit score,You can check your credit score for free on several websites such as Credit Karma and Credit Sesame.,2024-12-09 23:52:55
Do you like any color,"I'm a chatbot, so I don't have a favorite color.",2024-12-09 23:53:28
help me,How can I assist you?,2024-12-10 01:26:17
what is the weather,"Mindfulness is the practice of being fully present in the moment, observing thoughts and feelings without judgment.",2024-12-10 01:54:31
how is weather,"Mindfulness is the practice of being fully present in the moment, observing thoughts and feelings without judgment.",2024-12-10 01:54:40
weather,Growing a vegetable garden allows you to enjoy fresh produce and connect with nature.,2024-12-10 01:54:47
Can you tell me the time,You can check the time on your device or use a clock.,2024-12-10 01:55:09
Can you tell me the time,You can check the time on your device or use a clock.,2024-12-10 01:55:23
Make me laugh,Did you hear about the mathematician who’s afraid of negative numbers? He’ll stop at nothing to avoid them!,2024-12-10 01:55:48
